{
  "$schema": "../schemas/fixture-set.schema.json",
  "id": "booking-lifecycle",
  "status": "draft",
  "description": "Initial fixture set for booking read/write lifecycle, state transitions, idempotency, and side effects.",
  "owner": "compatibility-qa",
  "fixtures": [
    {
      "id": "booking.create.personal-basic",
      "surface": "api-v2",
      "operation": "POST /v2/bookings",
      "status": "needs-capture",
      "auth": "api-key",
      "comparison": "state",
      "securityBreaks": [],
      "inputs": [],
      "outputs": [],
      "schemas": [],
      "redactions": ["authorization", "attendee.email", "attendees.email", "responses.email"],
      "unstableFields": ["requestId", "bookingUid", "createdAt", "updatedAt"],
      "owner": "compatibility-qa"
    },
    {
      "id": "booking.create.duplicate-idempotency-key",
      "surface": "api-v2",
      "operation": "POST /v2/bookings",
      "status": "needs-capture",
      "auth": "api-key",
      "comparison": "state",
      "securityBreaks": [],
      "inputs": [],
      "outputs": [],
      "schemas": [],
      "redactions": ["authorization", "attendee.email", "attendees.email", "responses.email"],
      "unstableFields": ["requestId", "bookingUid", "createdAt", "updatedAt"],
      "owner": "compatibility-qa"
    },
    {
      "id": "booking.read.by-uid",
      "surface": "api-v2",
      "operation": "GET /v2/bookings/{bookingUid}",
      "status": "needs-capture",
      "auth": "api-key",
      "comparison": "schema",
      "securityBreaks": [],
      "inputs": [],
      "outputs": [],
      "schemas": [],
      "redactions": ["authorization", "attendee.email", "attendees.email", "responses.email"],
      "unstableFields": ["requestId", "createdAt", "updatedAt"],
      "owner": "compatibility-qa"
    },
    {
      "id": "booking.cancel.owner",
      "surface": "api-v2",
      "operation": "POST /v2/bookings/{bookingUid}/cancel",
      "status": "needs-capture",
      "auth": "api-key",
      "comparison": "side-effect",
      "securityBreaks": [],
      "inputs": [],
      "outputs": [],
      "schemas": [],
      "redactions": ["authorization", "attendee.email", "attendees.email", "responses.email"],
      "unstableFields": ["requestId", "updatedAt"],
      "owner": "compatibility-qa"
    },
    {
      "id": "booking.reschedule.owner",
      "surface": "api-v2",
      "operation": "POST /v2/bookings/{bookingUid}/reschedule",
      "status": "needs-capture",
      "auth": "api-key",
      "comparison": "side-effect",
      "securityBreaks": [],
      "inputs": [],
      "outputs": [],
      "schemas": [],
      "redactions": ["authorization", "attendee.email", "attendees.email", "responses.email"],
      "unstableFields": ["requestId", "oldBookingUid", "newBookingUid", "createdAt", "updatedAt"],
      "owner": "compatibility-qa"
    },
    {
      "id": "booking.create.unauthorized-user-denied",
      "surface": "api-v2",
      "operation": "POST /v2/bookings",
      "status": "needs-capture",
      "auth": "api-key",
      "comparison": "strict",
      "securityBreaks": [],
      "inputs": [],
      "outputs": [],
      "schemas": [],
      "redactions": ["authorization", "attendee.email"],
      "unstableFields": ["requestId"],
      "owner": "security"
    }
  ]
}
