{
  "$schema": "../schemas/fixture-set.schema.json",
  "id": "api-v2-auth",
  "status": "draft",
  "description": "Initial fixture set for API v2 authentication, platform OAuth, sessions, and token lifecycle behavior.",
  "owner": "compatibility-qa",
  "fixtures": [
    {
      "id": "api-v2-auth.oauth2-client-metadata.success",
      "surface": "api-v2",
      "operation": "GET /v2/auth/oauth2/clients/{clientId}",
      "status": "needs-capture",
      "auth": "api-key",
      "comparison": "strict",
      "securityBreaks": ["no-client-secret-in-response"],
      "inputs": [],
      "outputs": [],
      "schemas": [],
      "redactions": ["authorization"],
      "unstableFields": ["requestId", "createdAt", "updatedAt"],
      "owner": "compatibility-qa"
    },
    {
      "id": "api-v2-auth.oauth2-client-metadata.not-found",
      "surface": "api-v2",
      "operation": "GET /v2/auth/oauth2/clients/{clientId}",
      "status": "needs-capture",
      "auth": "api-key",
      "comparison": "strict",
      "securityBreaks": [],
      "inputs": [],
      "outputs": [],
      "schemas": [],
      "redactions": ["authorization"],
      "unstableFields": ["requestId"],
      "owner": "compatibility-qa"
    },
    {
      "id": "api-v2-auth.api-key.success",
      "surface": "api-v2",
      "operation": "GET /v2/me",
      "status": "needs-capture",
      "auth": "api-key",
      "comparison": "strict",
      "securityBreaks": [],
      "inputs": [],
      "outputs": [],
      "schemas": [],
      "redactions": ["authorization"],
      "unstableFields": ["requestId", "createdAt", "updatedAt"],
      "owner": "compatibility-qa"
    },
    {
      "id": "api-v2-auth.api-key.invalid",
      "surface": "api-v2",
      "operation": "GET /v2/me",
      "status": "needs-capture",
      "auth": "api-key",
      "comparison": "strict",
      "securityBreaks": [],
      "inputs": [],
      "outputs": [],
      "schemas": [],
      "redactions": ["authorization"],
      "unstableFields": ["requestId"],
      "owner": "compatibility-qa"
    },
    {
      "id": "api-v2-auth.platform-client.success",
      "surface": "api-v2",
      "operation": "GET /v2/oauth-clients/{clientId}",
      "status": "needs-capture",
      "auth": "platform-client-secret",
      "comparison": "strict",
      "securityBreaks": ["no-existing-client-secret-in-response"],
      "inputs": [],
      "outputs": [],
      "schemas": [],
      "redactions": ["x-cal-secret-key"],
      "unstableFields": ["requestId", "createdAt", "updatedAt"],
      "owner": "compatibility-qa"
    },
    {
      "id": "api-v2-auth.platform-client.invalid-secret",
      "surface": "api-v2",
      "operation": "GET /v2/oauth-clients/{clientId}",
      "status": "needs-capture",
      "auth": "platform-client-secret",
      "comparison": "strict",
      "securityBreaks": [],
      "inputs": [],
      "outputs": [],
      "schemas": [],
      "redactions": ["x-cal-secret-key"],
      "unstableFields": ["requestId"],
      "owner": "compatibility-qa"
    },
    {
      "id": "api-v2-auth.session.identity-mutation-rejected",
      "surface": "api-v2",
      "operation": "GET /v2/me",
      "status": "security-break",
      "auth": "session",
      "comparison": "security-break",
      "securityBreaks": ["server-owned-principal-identity"],
      "inputs": [],
      "outputs": [],
      "schemas": [],
      "redactions": ["cookie", "set-cookie"],
      "unstableFields": ["requestId"],
      "owner": "security"
    },
    {
      "id": "api-v2-auth.oauth-code.replay-denied",
      "surface": "api-v2",
      "operation": "POST /v2/auth/oauth2/token",
      "status": "security-break",
      "auth": "oauth-client",
      "comparison": "security-break",
      "securityBreaks": ["single-use-authorization-code"],
      "inputs": [],
      "outputs": [],
      "schemas": [],
      "redactions": ["client_secret", "code", "access_token", "refresh_token"],
      "unstableFields": ["requestId", "expiresAt", "accessTokenExpiresAt", "refreshTokenExpiresAt"],
      "owner": "security"
    }
  ]
}
